{
  "schemaVersion": "1.0",
  "id": "researchhub-quality",
  "version": "1",
  "description": "Authored synthetic RC laboratory and contrasting photovoltaic studies; no private/external data.",
  "referenceChunking": {
    "version": "hierarchical-char-1",
    "maxCharacters": 1600,
    "overlapCharacters": 150,
    "minCharacters": 200
  },
  "sources": [
    {
      "id": "182515c7-0821-5d2c-9c38-0a83e2fe26a7",
      "workspaceFixtureId": "287efdc6-809f-52ce-a95e-5b449234a21d",
      "title": "theory.pdf",
      "path": "theory.pdf",
      "sourceType": "PDF",
      "sha256": "22e4d538a1e68759abebe7fe9a0cfccefb6e1d272c55d51473c5c160ae87d996",
      "extractionSha256": "8323656a54249d0f6572014748b3aa931430b67b42936678da482434d61b526b"
    },
    {
      "id": "7880b6ce-5d31-547c-9df3-c150064e8b2b",
      "workspaceFixtureId": "287efdc6-809f-52ce-a95e-5b449234a21d",
      "title": "smith.pdf",
      "path": "smith.pdf",
      "sourceType": "PDF",
      "sha256": "bb1f10b55d45189355d9cb000bf3f832425bc4f84681c4010d622f91ed2fb057",
      "extractionSha256": "3012259659923870e821d5ca2d9a4bd840456d31ae81e4120cb3b0bb25c056d6"
    },
    {
      "id": "a8b1a6fe-bc2d-5ccd-af6a-574d88b2a3a0",
      "workspaceFixtureId": "287efdc6-809f-52ce-a95e-5b449234a21d",
      "title": "lee.pdf",
      "path": "lee.pdf",
      "sourceType": "PDF",
      "sha256": "040c307582038974a8561f704bcde77c8eefc3aeee32ee0279f454b00bc32192",
      "extractionSha256": "b8afb810530a10721d111d58a34d7ac338e43d951defcb1a3dabd0131c4335c7"
    },
    {
      "id": "08d76892-eb53-50a1-904f-1f534eeeee34",
      "workspaceFixtureId": "287efdc6-809f-52ce-a95e-5b449234a21d",
      "title": "protocol.docx",
      "path": "protocol.docx",
      "sourceType": "DOCX",
      "sha256": "8732425a6ccbb8ceb054caf6b9b92c34bd9e70ee08eed842e8e252b0a2d72065",
      "extractionSha256": "eb4b24cea70cc610800f39f1e30d632b79aa61d58e74c5ef15bdd67b5e3361df"
    },
    {
      "id": "c0e4ed7c-f9c4-5220-95c1-0b5ddd4551fc",
      "workspaceFixtureId": "287efdc6-809f-52ce-a95e-5b449234a21d",
      "title": "safety.txt",
      "path": "safety.txt",
      "sourceType": "TXT",
      "sha256": "b0519d42ddb98429ce4a2f832bb8f5e2af796796a922e4ac02be09d31604e970",
      "extractionSha256": "b0519d42ddb98429ce4a2f832bb8f5e2af796796a922e4ac02be09d31604e970"
    },
    {
      "id": "a5fa4961-8289-545a-93a1-47608ee9f179",
      "workspaceFixtureId": "287efdc6-809f-52ce-a95e-5b449234a21d",
      "title": "polish.txt",
      "path": "polish.txt",
      "sourceType": "TXT",
      "sha256": "2c42bc6893aa4145e36f3941abe40abe5b089774d059974dd025e8cc130f1348",
      "extractionSha256": "2c42bc6893aa4145e36f3941abe40abe5b089774d059974dd025e8cc130f1348"
    },
    {
      "id": "05141a52-2cb0-5d2c-96ac-ae9d489f8193",
      "workspaceFixtureId": "287efdc6-809f-52ce-a95e-5b449234a21d",
      "title": "measurements.csv",
      "path": "measurements.csv",
      "sourceType": "CSV",
      "sha256": "597ab7dad2dc34ba6524d24e8c998c9cd6991912d012d9fb15d06fc8250881b2",
      "extractionSha256": "a43e8adf4ea3233491b0e9e317f2707edf304dac0d90249d1beaf2a4993d0c67"
    },
    {
      "id": "59e26564-a1e2-543a-a44d-59468da24ed1",
      "workspaceFixtureId": "bf317b58-7303-5a33-b400-0b30ea1ecf1a",
      "title": "foreign.txt",
      "path": "foreign.txt",
      "sourceType": "TXT",
      "sha256": "bc4bd2c6a071ed6f7e78e2beb7c8f4caf3c327d0ed95faff22b08cf33f14d27b",
      "extractionSha256": "bc4bd2c6a071ed6f7e78e2beb7c8f4caf3c327d0ed95faff22b08cf33f14d27b"
    }
  ],
  "cases": [
    {
      "id": "rc-nominal",
      "question": "What is the nominal time constant?",
      "expectedAnswer": "The nominal time constant is 4.7 seconds.",
      "expectedStatus": "SUPPORTED",
      "expectedFacts": [
        {
          "id": "fact-c76e082f6232",
          "description": "The nominal time constant is 4.7 seconds.",
          "answerPatterns": [
            "the\\ nominal\\ time\\ constant\\ is\\ 4\\.7\\ seconds"
          ],
          "supportedStatements": [
            "the\\ nominal\\ time\\ constant\\ is\\ 4\\.7\\ seconds\\."
          ],
          "locations": [
            {
              "sourceId": "182515c7-0821-5d2c-9c38-0a83e2fe26a7",
              "page": 1,
              "unitId": "unit-0",
              "characterStart": 101,
              "characterEnd": 141,
              "chunkIds": [
                "1daabf3d10046a1747954b64d8ceb661abe037b64a5d952e5157d9706f619b9b"
              ]
            }
          ]
        }
      ],
      "expectedSourceIds": [
        "182515c7-0821-5d2c-9c38-0a83e2fe26a7"
      ],
      "workspaceFixtureId": "287efdc6-809f-52ce-a95e-5b449234a21d",
      "selectedSourceIds": null,
      "tags": [
        "theory",
        "numeric"
      ],
      "difficulty": "easy",
      "forbiddenPatterns": []
    },
    {
      "id": "rc-resistance",
      "question": "What is the nominal resistance?",
      "expectedAnswer": "The nominal resistance is 10000 ohms.",
      "expectedStatus": "SUPPORTED",
      "expectedFacts": [
        {
          "id": "fact-491bc5786127",
          "description": "The nominal resistance is 10000 ohms.",
          "answerPatterns": [
            "the\\ nominal\\ resistance\\ is\\ 10000\\ ohms"
          ],
          "supportedStatements": [
            "the\\ nominal\\ resistance\\ is\\ 10000\\ ohms\\."
          ],
          "locations": [
            {
              "sourceId": "182515c7-0821-5d2c-9c38-0a83e2fe26a7",
              "page": 1,
              "unitId": "unit-0",
              "characterStart": 19,
              "characterEnd": 55,
              "chunkIds": [
                "1daabf3d10046a1747954b64d8ceb661abe037b64a5d952e5157d9706f619b9b"
              ]
            }
          ]
        }
      ],
      "expectedSourceIds": [
        "182515c7-0821-5d2c-9c38-0a83e2fe26a7"
      ],
      "workspaceFixtureId": "287efdc6-809f-52ce-a95e-5b449234a21d",
      "selectedSourceIds": [
        "182515c7-0821-5d2c-9c38-0a83e2fe26a7"
      ],
      "tags": [
        "theory",
        "units"
      ],
      "difficulty": "easy",
      "forbiddenPatterns": []
    },
    {
      "id": "rc-capacitance",
      "question": "What is the nominal capacitance?",
      "expectedAnswer": "The nominal capacitance is 470 microfarads.",
      "expectedStatus": "SUPPORTED",
      "expectedFacts": [
        {
          "id": "fact-e5887481ed9c",
          "description": "The nominal capacitance is 470 microfarads.",
          "answerPatterns": [
            "the\\ nominal\\ capacitance\\ is\\ 470\\ microfarads"
          ],
          "supportedStatements": [
            "the\\ nominal\\ capacitance\\ is\\ 470\\ microfarads\\."
          ],
          "locations": [
            {
              "sourceId": "182515c7-0821-5d2c-9c38-0a83e2fe26a7",
              "page": 1,
              "unitId": "unit-0",
              "characterStart": 57,
              "characterEnd": 99,
              "chunkIds": [
                "1daabf3d10046a1747954b64d8ceb661abe037b64a5d952e5157d9706f619b9b"
              ]
            }
          ]
        }
      ],
      "expectedSourceIds": [
        "182515c7-0821-5d2c-9c38-0a83e2fe26a7"
      ],
      "workspaceFixtureId": "287efdc6-809f-52ce-a95e-5b449234a21d",
      "selectedSourceIds": [
        "182515c7-0821-5d2c-9c38-0a83e2fe26a7"
      ],
      "tags": [
        "theory",
        "units"
      ],
      "difficulty": "easy",
      "forbiddenPatterns": []
    },
    {
      "id": "rc-formula",
      "question": "How is the time constant calculated?",
      "expectedAnswer": "The time constant equals resistance multiplied by capacitance.",
      "expectedStatus": "SUPPORTED",
      "expectedFacts": [
        {
          "id": "fact-ac29edb31764",
          "description": "The time constant equals resistance multiplied by capacitance.",
          "answerPatterns": [
            "the\\ time\\ constant\\ equals\\ resistance\\ multiplied\\ by\\ capacitance"
          ],
          "supportedStatements": [
            "the\\ time\\ constant\\ equals\\ resistance\\ multiplied\\ by\\ capacitance\\."
          ],
          "locations": [
            {
              "sourceId": "182515c7-0821-5d2c-9c38-0a83e2fe26a7",
              "page": 1,
              "unitId": "unit-0",
              "characterStart": 143,
              "characterEnd": 204,
              "chunkIds": [
                "1daabf3d10046a1747954b64d8ceb661abe037b64a5d952e5157d9706f619b9b"
              ]
            }
          ]
        }
      ],
      "expectedSourceIds": [
        "182515c7-0821-5d2c-9c38-0a83e2fe26a7"
      ],
      "workspaceFixtureId": "287efdc6-809f-52ce-a95e-5b449234a21d",
      "selectedSourceIds": [
        "182515c7-0821-5d2c-9c38-0a83e2fe26a7"
      ],
      "tags": [
        "theory"
      ],
      "difficulty": "medium",
      "forbiddenPatterns": []
    },
    {
      "id": "rc-exponential",
      "question": "How does voltage change during discharge?",
      "expectedAnswer": "Voltage decreases exponentially during discharge.",
      "expectedStatus": "SUPPORTED",
      "expectedFacts": [
        {
          "id": "fact-3f4a73ad833f",
          "description": "Voltage decreases exponentially during discharge.",
          "answerPatterns": [
            "voltage\\ decreases\\ exponentially\\ during\\ discharge"
          ],
          "supportedStatements": [
            "voltage\\ decreases\\ exponentially\\ during\\ discharge\\."
          ],
          "locations": [
            {
              "sourceId": "182515c7-0821-5d2c-9c38-0a83e2fe26a7",
              "page": 2,
              "unitId": "unit-1",
              "characterStart": 222,
              "characterEnd": 270,
              "chunkIds": [
                "034af77ac8b6ecb047a5d16b2a1083f83631fcbe36ce808293a56076e8236223"
              ]
            }
          ]
        }
      ],
      "expectedSourceIds": [
        "182515c7-0821-5d2c-9c38-0a83e2fe26a7"
      ],